{
  "schema_version": "1.0",
  "source_digest": "fceacb0c6dce1a95a428e0a5422e8fb9b6e00c41c4f9e2aaddc6905f268880b5",
  "canonical_source": "book/*.md",
  "count": 60,
  "notice": "原创试做；预算非报价；背景研究不直接验证行动卡。",
  "cards": [
    {
      "id": "J001",
      "title": "听一首歌，别顺手做别的事",
      "minutes": 5,
      "budget": 0,
      "currency": "CNY",
      "company": "solo",
      "energy": "low",
      "evidence_type": "original_proposal",
      "fields": {
        "现在做": "从已经能播放的音乐里，选一首此刻最想听的。坐着、躺着或跟着晃都可以，别给它配工作。",
        "想得到": "不是背景音，而是“这一首是放给我听的”。",
        "付出": "预留 5 分钟，0 元；放下一小会儿手头的事。",
        "换小份": "只听最喜欢的一段。没有耳机、会打扰别人时，留到合适的地方或在心里哼。",
        "散场线": "不喜欢就切歌；声音让自己或别人不舒服就调低，不用完整听完证明认真。",
        "性质": "原创试做，不承诺改善情绪。"
      },
      "body": "- **现在做**：从已经能播放的音乐里，选一首此刻最想听的。坐着、躺着或跟着晃都可以，别给它配工作。\n- **想得到**：不是背景音，而是“这一首是放给我听的”。\n- **付出**：预留 5 分钟，0 元；放下一小会儿手头的事。\n- **换小份**：只听最喜欢的一段。没有耳机、会打扰别人时，留到合适的地方或在心里哼。\n- **散场线**：不喜欢就切歌；声音让自己或别人不舒服就调低，不用完整听完证明认真。\n- **性质**：原创试做，不承诺改善情绪。",
      "source": "book/01-start-now.md#j001",
      "source_url": "https://github.com/solomon-8/EnjoyTheMoment/blob/main/book/01-start-now.md#j001",
      "source_sha256": "cdd9b6118bca43f1eeec2572e1a7fb08adf80a1a531827f77af506a854e834b3",
      "chapter_id": "01",
      "chapter_title": "01 · 今天，不是未来的试用版",
      "background_ids": [],
      "essay_ids": [],
      "background_is_not_validation": true
    },
    {
      "id": "J002",
      "title": "把“以后用”改成“今天用”",
      "minutes": 10,
      "budget": 0,
      "currency": "CNY",
      "company": "solo",
      "energy": "low",
      "evidence_type": "original_proposal",
      "fields": {
        "现在做": "拿出已经拥有、却一直舍不得用的杯子、笔、香皂或床单，选一样投入今天。",
        "想得到": "好东西成为体验，而不只是被妥善保存的可能性。",
        "付出": "预留 10 分钟，0 元；接受正常使用会留下痕迹。",
        "换小份": "先用一次，不必一口气拆掉所有收藏。",
        "散场线": "不是你的物品先问；需要特殊保存的纪念品可以继续收藏，不必为了践行口号毁掉它。",
        "性质": "原创试做；“使用比收藏好”不是普遍事实。"
      },
      "body": "- **现在做**：拿出已经拥有、却一直舍不得用的杯子、笔、香皂或床单，选一样投入今天。\n- **想得到**：好东西成为体验，而不只是被妥善保存的可能性。\n- **付出**：预留 10 分钟，0 元；接受正常使用会留下痕迹。\n- **换小份**：先用一次，不必一口气拆掉所有收藏。\n- **散场线**：不是你的物品先问；需要特殊保存的纪念品可以继续收藏，不必为了践行口号毁掉它。\n- **性质**：原创试做；“使用比收藏好”不是普遍事实。",
      "source": "book/01-start-now.md#j002",
      "source_url": "https://github.com/solomon-8/EnjoyTheMoment/blob/main/book/01-start-now.md#j002",
      "source_sha256": "cdd9b6118bca43f1eeec2572e1a7fb08adf80a1a531827f77af506a854e834b3",
      "chapter_id": "01",
      "chapter_title": "01 · 今天，不是未来的试用版",
      "background_ids": [],
      "essay_ids": [],
      "background_is_not_validation": true
    },
    {
      "id": "J003",
      "title": "五分钟内，让一个角落变顺眼",
      "minutes": 5,
      "budget": 0,
      "currency": "CNY",
      "company": "solo",
      "energy": "low",
      "evidence_type": "original_proposal",
      "fields": {
        "现在做": "只改眼前一个地方：换张桌面照片、把喜欢的摆件放近一点、让椅子朝向更舒服的方向。",
        "想得到": "一个立刻能看见的“我喜欢这里”。",
        "付出": "预留 5 分钟，0 元；不扩展成全屋整理。",
        "换小份": "只调整手机壁纸或一件小东西的位置。",
        "散场线": "改动公共空间先协商；发现自己开始购买整套收纳方案，就先停在原地。",
        "性质": "原创试做，不承诺空间改造效果。"
      },
      "body": "- **现在做**：只改眼前一个地方：换张桌面照片、把喜欢的摆件放近一点、让椅子朝向更舒服的方向。\n- **想得到**：一个立刻能看见的“我喜欢这里”。\n- **付出**：预留 5 分钟，0 元；不扩展成全屋整理。\n- **换小份**：只调整手机壁纸或一件小东西的位置。\n- **散场线**：改动公共空间先协商；发现自己开始购买整套收纳方案，就先停在原地。\n- **性质**：原创试做，不承诺空间改造效果。",
      "source": "book/01-start-now.md#j003",
      "source_url": "https://github.com/solomon-8/EnjoyTheMoment/blob/main/book/01-start-now.md#j003",
      "source_sha256": "cdd9b6118bca43f1eeec2572e1a7fb08adf80a1a531827f77af506a854e834b3",
      "chapter_id": "01",
      "chapter_title": "01 · 今天，不是未来的试用版",
      "background_ids": [],
      "essay_ids": [],
      "background_is_not_validation": true
    },
    {
      "id": "J004",
      "title": "把喜欢的衣服穿到普通的一天",
      "minutes": 10,
      "budget": 0,
      "currency": "CNY",
      "company": "solo",
      "energy": "low",
      "evidence_type": "original_proposal",
      "fields": {
        "现在做": "从现有衣服里挑一件喜欢的，不等聚会、不等拍照、不等身材变成另一个版本。",
        "想得到": "不是为了被看见，而是自己穿上就有点高兴。",
        "付出": "预留 10 分钟，0 元；可能比平常多一点搭配心思。",
        "换小份": "换一双袜子、一件配饰或一种颜色就够。",
        "散场线": "以当下穿着舒适和活动要求为准；勒、不便或不喜欢就换，不用硬撑。",
        "性质": "原创试做，不是外形评判。"
      },
      "body": "- **现在做**：从现有衣服里挑一件喜欢的，不等聚会、不等拍照、不等身材变成另一个版本。\n- **想得到**：不是为了被看见，而是自己穿上就有点高兴。\n- **付出**：预留 10 分钟，0 元；可能比平常多一点搭配心思。\n- **换小份**：换一双袜子、一件配饰或一种颜色就够。\n- **散场线**：以当下穿着舒适和活动要求为准；勒、不便或不喜欢就换，不用硬撑。\n- **性质**：原创试做，不是外形评判。",
      "source": "book/01-start-now.md#j004",
      "source_url": "https://github.com/solomon-8/EnjoyTheMoment/blob/main/book/01-start-now.md#j004",
      "source_sha256": "cdd9b6118bca43f1eeec2572e1a7fb08adf80a1a531827f77af506a854e834b3",
      "chapter_id": "01",
      "chapter_title": "01 · 今天，不是未来的试用版",
      "background_ids": [],
      "essay_ids": [],
      "background_is_not_validation": true
    },
    {
      "id": "J005",
      "title": "没有节日，也可以认真吃一顿",
      "minutes": 20,
      "budget": 0,
      "currency": "CNY",
      "company": "either",
      "energy": "low",
      "evidence_type": "original_proposal",
      "fields": {
        "现在做": "把今天原本就要吃的饭盛好，坐下吃，拿掉不必要的工作页面。不必加菜，也不必摆拍。",
        "想得到": "这顿饭属于生活，而不只是给下一项任务补充燃料。",
        "付出": "预留 20 分钟；不增加餐费，可能要多洗一个盘子。",
        "换小份": "认真吃前几口，再回到现实安排。",
        "散场线": "忙乱、照料家人或身体状态不允许时，方便比仪式重要。",
        "性质": "原创试做，不作营养或健康主张。"
      },
      "body": "- **现在做**：把今天原本就要吃的饭盛好，坐下吃，拿掉不必要的工作页面。不必加菜，也不必摆拍。\n- **想得到**：这顿饭属于生活，而不只是给下一项任务补充燃料。\n- **付出**：预留 20 分钟；不增加餐费，可能要多洗一个盘子。\n- **换小份**：认真吃前几口，再回到现实安排。\n- **散场线**：忙乱、照料家人或身体状态不允许时，方便比仪式重要。\n- **性质**：原创试做，不作营养或健康主张。",
      "source": "book/01-start-now.md#j005",
      "source_url": "https://github.com/solomon-8/EnjoyTheMoment/blob/main/book/01-start-now.md#j005",
      "source_sha256": "cdd9b6118bca43f1eeec2572e1a7fb08adf80a1a531827f77af506a854e834b3",
      "chapter_id": "01",
      "chapter_title": "01 · 今天，不是未来的试用版",
      "background_ids": [],
      "essay_ids": [],
      "background_is_not_validation": true
    },
    {
      "id": "J006",
      "title": "从收藏夹里兑现一个最小愿望",
      "minutes": 15,
      "budget": 0,
      "currency": "CNY",
      "company": "solo",
      "energy": "low",
      "evidence_type": "original_proposal",
      "fields": {
        "现在做": "打开“以后看”，只找一个现在可用、免费的短内容，真的看它，而不是继续收藏。",
        "想得到": "从想象自己会喜欢，走到亲自喜欢或不喜欢。",
        "付出": "预留 15 分钟，0 元；放弃这次同时筛选十个选项。",
        "换小份": "只看开头；也可以直接删掉一个已经不想看的收藏。",
        "散场线": "付费、时长或内容不合适就换；收藏过不等于欠它一次观看。",
        "性质": "原创试做，不把收藏习惯诊断成问题。"
      },
      "body": "- **现在做**：打开“以后看”，只找一个现在可用、免费的短内容，真的看它，而不是继续收藏。\n- **想得到**：从想象自己会喜欢，走到亲自喜欢或不喜欢。\n- **付出**：预留 15 分钟，0 元；放弃这次同时筛选十个选项。\n- **换小份**：只看开头；也可以直接删掉一个已经不想看的收藏。\n- **散场线**：付费、时长或内容不合适就换；收藏过不等于欠它一次观看。\n- **性质**：原创试做，不把收藏习惯诊断成问题。",
      "source": "book/01-start-now.md#j006",
      "source_url": "https://github.com/solomon-8/EnjoyTheMoment/blob/main/book/01-start-now.md#j006",
      "source_sha256": "cdd9b6118bca43f1eeec2572e1a7fb08adf80a1a531827f77af506a854e834b3",
      "chapter_id": "01",
      "chapter_title": "01 · 今天，不是未来的试用版",
      "background_ids": [
        "B04"
      ],
      "essay_ids": [
        "E03"
      ],
      "background_is_not_validation": true
    },
    {
      "id": "J007",
      "title": "点真正想吃的那一份",
      "minutes": 30,
      "budget": 30,
      "currency": "CNY",
      "company": "either",
      "energy": "low",
      "evidence_type": "original_proposal",
      "fields": {
        "现在做": "在自己能接受、适合自己食用且总价不超过预算的选项里，选真正想吃的，而不是为了划算多点一堆。",
        "想得到": "吃到想要的味道，而不只是完成一场价格比较。",
        "付出": "给这一餐或加餐预留 30 分钟、至多 30 元；当地没有合适选项就不用花。",
        "换小份": "家里现成的食物换个自己喜欢的搭配，也可以把原本要买的大份改成小份。",
        "散场线": "不舒服、吃够了就停；已知过敏和个人医疗要求不属于本卡可以替你豁免的条件。",
        "性质": "原创试做，金额是预算示例而非报价。"
      },
      "body": "- **现在做**：在自己能接受、适合自己食用且总价不超过预算的选项里，选真正想吃的，而不是为了划算多点一堆。\n- **想得到**：吃到想要的味道，而不只是完成一场价格比较。\n- **付出**：给这一餐或加餐预留 30 分钟、至多 30 元；当地没有合适选项就不用花。\n- **换小份**：家里现成的食物换个自己喜欢的搭配，也可以把原本要买的大份改成小份。\n- **散场线**：不舒服、吃够了就停；已知过敏和个人医疗要求不属于本卡可以替你豁免的条件。\n- **性质**：原创试做，金额是预算示例而非报价。",
      "source": "book/02-senses.md#j007",
      "source_url": "https://github.com/solomon-8/EnjoyTheMoment/blob/main/book/02-senses.md#j007",
      "source_sha256": "7ccc1de7e85be90c0eb8d06e01a5361d0886626385a925885a7bdd142a2f914e",
      "chapter_id": "02",
      "chapter_title": "02 · 身体不是只用来工作的",
      "background_ids": [],
      "essay_ids": [],
      "background_is_not_validation": true
    },
    {
      "id": "J008",
      "title": "在家给自己开一场小型现场",
      "minutes": 20,
      "budget": 0,
      "currency": "CNY",
      "company": "either",
      "energy": "high",
      "evidence_type": "original_proposal",
      "fields": {
        "现在做": "用现有播放设备选三首想跟唱的歌，唱、打拍子、坐着摆动都可以。",
        "想得到": "一点热闹和参与感，而不只是旁观别人的现场。",
        "付出": "预留 20 分钟，0 元；需要不打扰他人的时间和空间。",
        "换小份": "戴耳机听一首，轻轻跟着哼。",
        "散场线": "邻居、同住者不方便或自己不舒服，就调低音量、缩小动作或结束。",
        "性质": "原创试做，不承诺运动或心理效果。"
      },
      "body": "- **现在做**：用现有播放设备选三首想跟唱的歌，唱、打拍子、坐着摆动都可以。\n- **想得到**：一点热闹和参与感，而不只是旁观别人的现场。\n- **付出**：预留 20 分钟，0 元；需要不打扰他人的时间和空间。\n- **换小份**：戴耳机听一首，轻轻跟着哼。\n- **散场线**：邻居、同住者不方便或自己不舒服，就调低音量、缩小动作或结束。\n- **性质**：原创试做，不承诺运动或心理效果。",
      "source": "book/02-senses.md#j008",
      "source_url": "https://github.com/solomon-8/EnjoyTheMoment/blob/main/book/02-senses.md#j008",
      "source_sha256": "7ccc1de7e85be90c0eb8d06e01a5361d0886626385a925885a7bdd142a2f914e",
      "chapter_id": "02",
      "chapter_title": "02 · 身体不是只用来工作的",
      "background_ids": [],
      "essay_ids": [],
      "background_is_not_validation": true
    },
    {
      "id": "J009",
      "title": "让一次洗漱不赶时间",
      "minutes": 15,
      "budget": 0,
      "currency": "CNY",
      "company": "solo",
      "energy": "low",
      "evidence_type": "original_proposal",
      "fields": {
        "现在做": "把原本就要进行的一次洗漱留得从容一点，使用现有、适合自己的用品。",
        "想得到": "一段没有被催促的身体体验。",
        "付出": "预留 15 分钟，不额外购物；用水等日常开销照常存在。",
        "换小份": "只慢慢洗手，擦干后涂自己已经在用的护手用品。",
        "散场线": "水温、气味或用品让你不适就停止，不追求烫、冰或强烈刺激。",
        "性质": "原创试做，不涉及治疗、保健效果。"
      },